{
  "format":"axiom-g3-gate-report-v1","formatVersion":1,"authority":"G3_GATE_REPORT","gate":"G3","status":"BLOCKED","sourceCommit":"aaaaaaaaaaaaaaaaaaaaaaaaaaaaaaaaaaaaaaaa","branch":"main","generatorVersion":"0.1.0",
  "wpLineage":[{"taskId":"GT-G3-01","status":"PASS","resultRevision":"bbbbbbbbbbbbbbbbbbbbbbbbbbbbbbbbbbbbbbbb","integrationRevision":"cccccccccccccccccccccccccccccccccccccccc","evidenceRefs":[".aegis/results/GT-G3-01/result.json"]},{"taskId":"GT-G3-02","status":"PASS_WITH_FINDINGS","resultRevision":"bbbbbbbbbbbbbbbbbbbbbbbbbbbbbbbbbbbbbbbb","integrationRevision":"cccccccccccccccccccccccccccccccccccccccc","evidenceRefs":[".aegis/results/GT-G3-02/result.json"]},{"taskId":"GT-G3-03","status":"PASS","resultRevision":"bbbbbbbbbbbbbbbbbbbbbbbbbbbbbbbbbbbbbbbb","integrationRevision":"cccccccccccccccccccccccccccccccccccccccc","evidenceRefs":[".aegis/results/GT-G3-03/result.json"]},{"taskId":"GT-G3-04","status":"PASS","resultRevision":"bbbbbbbbbbbbbbbbbbbbbbbbbbbbbbbbbbbbbbbb","integrationRevision":"cccccccccccccccccccccccccccccccccccccccc","evidenceRefs":[".aegis/results/GT-G3-04/result.json"]},{"taskId":"GT-G3-05","status":"PASS","resultRevision":"bbbbbbbbbbbbbbbbbbbbbbbbbbbbbbbbbbbbbbbb","integrationRevision":"cccccccccccccccccccccccccccccccccccccccc","evidenceRefs":[".aegis/results/GT-G3-05/result.json"]},{"taskId":"GT-G3-06","status":"PASS_WITH_FINDINGS","resultRevision":"bbbbbbbbbbbbbbbbbbbbbbbbbbbbbbbbbbbbbbbb","integrationRevision":"cccccccccccccccccccccccccccccccccccccccc","evidenceRefs":[".aegis/results/GT-G3-06/result.json"]},{"taskId":"GT-G3-07","status":"PASS","resultRevision":"bbbbbbbbbbbbbbbbbbbbbbbbbbbbbbbbbbbbbbbb","integrationRevision":"cccccccccccccccccccccccccccccccccccccccc","evidenceRefs":[".aegis/results/GT-G3-07/result.json"]},{"taskId":"GT-G3-08","status":"PASS","resultRevision":"bbbbbbbbbbbbbbbbbbbbbbbbbbbbbbbbbbbbbbbb","integrationRevision":"cccccccccccccccccccccccccccccccccccccccc","evidenceRefs":[".aegis/results/GT-G3-08/result.json"]},{"taskId":"GT-G3-09","status":"PASS","resultRevision":"bbbbbbbbbbbbbbbbbbbbbbbbbbbbbbbbbbbbbbbb","integrationRevision":"cccccccccccccccccccccccccccccccccccccccc","evidenceRefs":[".aegis/results/GT-G3-09/result.json"]},{"taskId":"GT-G3-10","status":"PASS","resultRevision":"bbbbbbbbbbbbbbbbbbbbbbbbbbbbbbbbbbbbbbbb","integrationRevision":"cccccccccccccccccccccccccccccccccccccccc","evidenceRefs":[".aegis/results/GT-G3-10/result.json"]}],
  "checks":[{"id":"structural","status":"PASS","required":true,"evidenceRefs":[".aegis/results/GT-G3-11/structural.json"],"issues":[]}],
  "platforms":[{"subject":"web","platformFamily":"WEB","status":"BLOCKED","reality":"NOT_APPLICABLE","evidencePath":"verification/evidence/web.json","sourceCommit":"aaaaaaaaaaaaaaaaaaaaaaaaaaaaaaaaaaaaaaaa"}],
  "issues":["MISSING_PLATFORM:windows"],"inputSha256":{"lineage":"dddddddddddddddddddddddddddddddddddddddddddddddddddddddddddddddd"},"promotion":{"allowed":false,"reason":"G3 Gate is not eligible for promotion"}
}
